{
  "device": {
    "bond_scale": [
      0.954430427061,
      1.181827342431,
      0.34,
      1.47,
      0.956768227138,
      1.039594664064
    ],
    "cells": 7,
    "contact_scale_left": 1.21,
    "contact_scale_right": 0.87,
    "site_potential": [
      [
        -0.35323045041,
        -0.038311002033,
        0.081495831215
      ],
      [
        0.288113009045,
        -0.137704216732,
        0.211906987595
      ],
      [
        0.268348024771,
        -0.001938372344,
        0.21066522495
      ],
      [
        -0.266280441275,
        3.75,
        0.148079625017
      ],
      [
        -1.85,
        0.014071920293,
        0.532055269604
      ],
      [
        0.157767333225,
        0.013260572952,
        0.161534962666
      ],
      [
        0.064328920213,
        0.103565025717,
        -0.047019584604
      ]
    ]
  },
  "energy_grid": [
    -0.668511261659,
    2.494543997693,
    -2.406696722052,
    2.977928427395,
    -4.434045919457,
    4.578409416685,
    -3.970763139363,
    1.380057420755,
    1.684489052661,
    -5.578378265409,
    -5.192812523289,
    -3.599660935954,
    3.756032334604,
    5.020036227188,
    3.398335436051,
    0.162665279155,
    0.957435731232,
    -1.900204130074,
    0.460872377322,
    4.234758178098,
    -2.73110252659,
    -1.492019881462,
    -4.8367577531,
    2.135502908026,
    5.350922100534,
    -3.12131218419,
    -6.0,
    6.2,
    -4.8367577531,
    -0.372697354408,
    -1.125515775738
  ],
  "eta": 0.11,
  "hoppings": {
    "A|A": {
      "pp_pi": -0.273956650247,
      "pp_sigma": 0.914451299784,
      "sp_sigma": 0.633437237535,
      "ss_sigma": -0.906881906566
    },
    "A|B": {
      "pp_pi": -0.2537980932,
      "pp_sigma": 1.016885355639,
      "sp_sigma": 0.696979495731,
      "ss_sigma": -0.94891560205
    },
    "A|C": {
      "pp_pi": -0.357101657252,
      "pp_sigma": 1.143247552438,
      "sp_sigma": 0.770164152709,
      "ss_sigma": -0.853125316939
    },
    "B|B": {
      "pp_pi": -0.266416677402,
      "pp_sigma": 0.944884262497,
      "sp_sigma": 0.711715882122,
      "ss_sigma": -0.833624071124
    },
    "B|C": {
      "pp_pi": -0.339793687076,
      "pp_sigma": 1.150172580717,
      "sp_sigma": 0.746789071986,
      "ss_sigma": -0.927052057388
    },
    "C|C": {
      "pp_pi": -0.370512889716,
      "pp_sigma": 1.171836721618,
      "sp_sigma": 0.815214251512,
      "ss_sigma": -1.046371279314
    }
  },
  "lattice_vector": [
    2.51,
    0.18,
    -0.09
  ],
  "model_id": "hidden_strong_defect",
  "neighbor_cutoff": 2.648054804804692,
  "phase_grid": [
    -1.859793365775,
    -0.624913828555,
    1.721585462946,
    -0.474288298793,
    -1.110783696102,
    0.737469685668,
    1.107271800399,
    2.419542850385,
    3.14159265359,
    2.072123151065,
    -3.14159265359,
    1.291503291138,
    -1.399611354957,
    0.0,
    -2.562833468641,
    0.387006198838,
    -2.103308680367,
    -2.562833468641,
    -2.754138866054
  ],
  "schema_version": "periodic-orbital-device/v1",
  "sites": [
    {
      "id": "defect_left",
      "position": [
        0.0,
        0.0,
        0.0
      ],
      "species": "A"
    },
    {
      "id": "defect_center",
      "position": [
        0.82,
        -0.24,
        0.19
      ],
      "species": "B"
    },
    {
      "id": "defect_right",
      "position": [
        1.62,
        0.22,
        -0.16
      ],
      "species": "C"
    }
  ],
  "species": {
    "A": {
      "onsite": {
        "px": 0.36,
        "py": 0.71,
        "pz": 1.09,
        "s": -0.49
      },
      "orbitals": [
        "s",
        "px",
        "py",
        "pz"
      ]
    },
    "B": {
      "onsite": {
        "s": 0.37
      },
      "orbitals": [
        "s"
      ]
    },
    "C": {
      "onsite": {
        "px": 0.59,
        "py": 0.88,
        "pz": 1.26,
        "s": 0.12
      },
      "orbitals": [
        "s",
        "px",
        "py",
        "pz"
      ]
    }
  }
}
