{
  "device": {
    "bond_scale": [
      1.227423081884,
      1.001750941442,
      0.902189175658,
      0.792278279988,
      0.804923886915,
      0.982018653209
    ],
    "cells": 7,
    "contact_scale_left": 0.14,
    "contact_scale_right": 0.19,
    "site_potential": [
      [
        0.174902259417,
        -0.082975387176
      ],
      [
        0.095191764721,
        -0.08895557192
      ],
      [
        0.121486648683,
        -0.0060450635
      ],
      [
        0.047611003415,
        -0.229468314282
      ],
      [
        -0.053270911456,
        -0.168560038394
      ],
      [
        -0.125992540963,
        0.083814985669
      ],
      [
        -0.177696083936,
        0.186143483776
      ]
    ]
  },
  "energy_grid": [
    -2.50792396787,
    -2.218181007584,
    0.459615800734,
    5.1,
    3.380799355319,
    3.77460065068,
    0.754280796368,
    -0.598517147916,
    -1.947380970844,
    -3.910719632995,
    -4.9,
    2.130248116235,
    0.161555194613,
    2.416964347026,
    -3.622582206491,
    -0.215143185053,
    -3.26870502461,
    -1.549849240355,
    1.794277397389,
    1.39815304705,
    -4.542022517415,
    -3.910719632995,
    1.100504611895,
    4.408975370522,
    -4.268080724749,
    3.094622416923,
    -2.846468662896,
    -1.220567448627,
    4.15585539272,
    2.792253060742,
    -0.901057905212
  ],
  "eta": 0.05,
  "hoppings": {
    "Lead|Lead": {
      "pp_pi": -0.251835555712,
      "pp_sigma": 1.039790650981,
      "sp_sigma": 0.613515400909,
      "ss_sigma": -0.751469707355
    }
  },
  "lattice_vector": [
    2.43,
    -0.13,
    0.17
  ],
  "model_id": "hidden_weak_contact",
  "neighbor_cutoff": 2.619405665320961,
  "phase_grid": [
    -1.766241785298,
    3.14159265359,
    0.363570241932,
    2.2335745447,
    -0.184506761381,
    0.574003078878,
    0.899233555306,
    1.195025406362,
    -1.05902834661,
    1.789052529067,
    0.0,
    -2.496125708908,
    -2.764847576978,
    2.463349973203,
    -2.311559592236,
    -1.614413092319,
    -0.542882384062,
    1.546298422926,
    -1.231580853636,
    -3.14159265359,
    -2.496125708908
  ],
  "schema_version": "periodic-orbital-device/v1",
  "sites": [
    {
      "id": "lead_a",
      "position": [
        0.0,
        0.0,
        0.0
      ],
      "species": "Lead"
    },
    {
      "id": "lead_b",
      "position": [
        1.09,
        0.29,
        -0.21
      ],
      "species": "Lead"
    }
  ],
  "species": {
    "Lead": {
      "onsite": {
        "px": 0.42,
        "py": 0.77,
        "pz": 1.05,
        "s": -0.26
      },
      "orbitals": [
        "s",
        "px",
        "py",
        "pz"
      ]
    }
  }
}
