{
  "device": {
    "bond_scale": [
      0.981729032826,
      1.230359026943,
      0.893389448372,
      1.043213593234
    ],
    "cells": 5,
    "contact_scale_left": 1.136677584377,
    "contact_scale_right": 0.90617641857,
    "site_potential": [
      [
        0.215261101037,
        -0.131187619379
      ],
      [
        -0.045615423312,
        0.008066771861
      ],
      [
        0.044211197501,
        0.036263087415
      ],
      [
        0.072779484547,
        -0.114332219235
      ],
      [
        0.189740645714,
        -0.019718020064
      ]
    ]
  },
  "energy_grid": [
    -3.23129769202,
    -0.653972231776,
    1.724446399669,
    3.291034368556,
    -2.792001029306,
    2.503604195133,
    -1.608572368377,
    0.108230875614,
    -1.165119264059,
    -3.963608570112,
    0.476014803086,
    1.386002032838,
    -4.389614237304,
    5.0,
    3.765196160477,
    -4.8,
    -0.35145414239,
    -3.525186271307,
    -2.408632178767,
    4.193195536154,
    0.941883759648,
    -2.011804585848,
    -3.525186271307,
    3.020467203852,
    2.131115924383
  ],
  "eta": 0.07,
  "hoppings": {
    "Mix|Mix": {
      "pp_pi": -0.249634914018,
      "pp_sigma": 0.854887671957,
      "sp_sigma": 0.591483206335,
      "ss_sigma": -0.734230782019
    },
    "Mix|Solo": {
      "pp_pi": -0.307153362447,
      "pp_sigma": 0.840707110725,
      "sp_sigma": 0.617823377614,
      "ss_sigma": -0.756590021382
    },
    "Solo|Solo": {
      "pp_pi": -0.294660912722,
      "pp_sigma": 0.915538734346,
      "sp_sigma": 0.718515693209,
      "ss_sigma": -0.895410741542
    }
  },
  "lattice_vector": [
    2.36,
    0.15,
    0.2
  ],
  "model_id": "hidden_energy_shift_base",
  "neighbor_cutoff": 2.533204584522792,
  "phase_grid": [
    -0.61460055423,
    -2.481108312667,
    0.0,
    1.76631715751,
    -2.481108312667,
    0.794776731139,
    -1.088770004176,
    0.316899562538,
    1.270476601143,
    2.523145323464,
    -1.804903833281,
    -1.996505093841,
    1.049911135552,
    2.117618461944,
    -2.807125042863,
    -0.378993369099,
    3.14159265359,
    -3.14159265359,
    -1.355248026332
  ],
  "schema_version": "periodic-orbital-device/v1",
  "sites": [
    {
      "id": "mix",
      "position": [
        0.0,
        0.0,
        0.0
      ],
      "species": "Mix"
    },
    {
      "id": "solo",
      "position": [
        1.04,
        -0.27,
        0.16
      ],
      "species": "Solo"
    }
  ],
  "species": {
    "Mix": {
      "onsite": {
        "px": 0.28,
        "py": 0.63,
        "pz": 0.98,
        "s": -0.57
      },
      "orbitals": [
        "s",
        "px",
        "py",
        "pz"
      ]
    },
    "Solo": {
      "onsite": {
        "s": 0.24
      },
      "orbitals": [
        "s"
      ]
    }
  }
}
