{
  "device": {
    "bond_scale": [
      0.963214490633,
      1.210730109185,
      1.171705759874,
      1.136297640362,
      0.937150120669
    ],
    "cells": 6,
    "contact_scale_left": 1.130829864394,
    "contact_scale_right": 1.136942196328,
    "site_potential": [
      [
        0.086968214882,
        -0.214077492664,
        0.085366571338,
        -0.110918606644
      ],
      [
        0.047629545001,
        -0.191628953552,
        -0.134036122975,
        -0.26714204417
      ],
      [
        0.503739416654,
        0.003746002458,
        0.238291550817,
        0.229182640523
      ],
      [
        0.407622519344,
        -0.399818295003,
        -0.006436394937,
        0.423050112197
      ],
      [
        0.000484337886,
        0.210147634976,
        -0.003509856675,
        -0.233694862709
      ],
      [
        -0.08972643624,
        0.270112854185,
        -0.10238624592,
        -0.169230367248
      ]
    ]
  },
  "energy_grid": [
    0.941660717763,
    3.214972384916,
    0.110646238459,
    3.573857970792,
    -3.844831155936,
    4.389486195335,
    -0.334131555287,
    2.395683506199,
    -4.618470338587,
    2.089930044419,
    -1.84462391564,
    -1.399380335569,
    3.989846755736,
    0.447531860862,
    -4.171349314351,
    -2.679901671538,
    -0.620625618313,
    -5.4,
    -3.03330277926,
    -2.301016142778,
    2.819167177523,
    -5.00197551028,
    4.767337346783,
    -3.479669059763,
    5.6,
    1.655206557415,
    -1.039558829257,
    -4.171349314351,
    1.208823744334
  ],
  "eta": 0.08,
  "hoppings": {
    "Core|Core": {
      "pp_pi": -0.267031412635,
      "pp_sigma": 0.862458988353,
      "sp_sigma": 0.639377377929,
      "ss_sigma": -0.780004297504
    },
    "Core|Dot": {
      "pp_pi": -0.307855507492,
      "pp_sigma": 1.051628982486,
      "sp_sigma": 0.741524984256,
      "ss_sigma": -0.759231668702
    },
    "Core|Shell": {
      "pp_pi": -0.307406541355,
      "pp_sigma": 0.904163942768,
      "sp_sigma": 0.767893810613,
      "ss_sigma": -0.790223533807
    },
    "Dot|Dot": {
      "pp_pi": -0.366569130708,
      "pp_sigma": 1.054857125685,
      "sp_sigma": 0.705587338627,
      "ss_sigma": -0.925266476133
    },
    "Dot|Shell": {
      "pp_pi": -0.371469756621,
      "pp_sigma": 1.10244360792,
      "sp_sigma": 0.738144179089,
      "ss_sigma": -0.85220963606
    },
    "Shell|Shell": {
      "pp_pi": -0.265884348838,
      "pp_sigma": 1.142986984719,
      "sp_sigma": 0.731673087902,
      "ss_sigma": -0.879133429967
    }
  },
  "lattice_vector": [
    0.493846153846,
    -2.01,
    1.549230769231
  ],
  "model_id": "hidden_heterogeneous_s_sp",
  "neighbor_cutoff": 2.735362643808517,
  "phase_grid": [
    -0.250612860851,
    1.627566756363,
    0.0,
    -0.928100868621,
    -2.515935649609,
    -1.054358063633,
    1.514799707964,
    0.564633478762,
    -2.515935649609,
    -3.14159265359,
    -1.638699513196,
    -1.537737741731,
    -2.085328235924,
    2.210298180359,
    -0.508625887345,
    0.785295818612,
    1.137300983474,
    0.225560299171,
    -2.200467882645,
    -2.92919418415,
    1.906355458292,
    2.517583547451,
    3.14159265359
  ],
  "schema_version": "periodic-orbital-device/v1",
  "sites": [
    {
      "id": "core",
      "position": [
        0.0,
        0.0,
        0.0
      ],
      "species": "Core"
    },
    {
      "id": "dot_a",
      "position": [
        0.353076923077,
        -0.312,
        0.431384615385
      ],
      "species": "Dot"
    },
    {
      "id": "shell",
      "position": [
        -0.018461538462,
        -1.1,
        0.657692307692
      ],
      "species": "Shell"
    },
    {
      "id": "dot_b",
      "position": [
        0.591538461538,
        -1.432,
        1.133692307692
      ],
      "species": "Dot"
    }
  ],
  "species": {
    "Core": {
      "onsite": {
        "px": 0.34,
        "py": 0.69,
        "pz": 1.08,
        "s": -0.61
      },
      "orbitals": [
        "s",
        "px",
        "py",
        "pz"
      ]
    },
    "Dot": {
      "onsite": {
        "s": 0.43
      },
      "orbitals": [
        "s"
      ]
    },
    "Shell": {
      "onsite": {
        "px": 0.51,
        "py": 0.82,
        "pz": 1.21,
        "s": 0.08
      },
      "orbitals": [
        "s",
        "px",
        "py",
        "pz"
      ]
    }
  }
}
