{
  "device": {
    "bond_scale": [
      0.852863064698,
      0.953663442794,
      1.009428393729,
      1.186752584106
    ],
    "cells": 5,
    "contact_scale_left": 0.870983696777,
    "contact_scale_right": 0.945151912428,
    "site_potential": [
      [
        0.127394811332,
        0.081454598084
      ],
      [
        -0.093052575609,
        -0.152036132778
      ],
      [
        -0.090704405671,
        -0.017771762529
      ],
      [
        -0.172588756516,
        -0.21360152255
      ],
      [
        0.073468563413,
        -0.062658383757
      ]
    ]
  },
  "energy_grid": [
    3.59064988994,
    1.654704542688,
    3.982701352709,
    5.2,
    -4.626984691867,
    -3.791141579976,
    -3.791141579976,
    2.116948916991,
    -3.025162418629,
    2.871264113071,
    0.05907794103,
    -5.0,
    -1.123704076518,
    2.458062692142,
    0.828857604424,
    1.33020826079,
    3.20072934937,
    -0.712953963267,
    -1.844356457448,
    -2.657573862258,
    -0.338599970334,
    -3.488359414958,
    0.462587415584,
    -2.193018922084,
    -1.403213493193,
    4.404912113114,
    -4.288401036491
  ],
  "eta": 0.06,
  "hoppings": {
    "L|L": {
      "pp_pi": -0.235880514704,
      "pp_sigma": 0.986870138989,
      "sp_sigma": 0.58139829043,
      "ss_sigma": -0.741181953357
    },
    "L|R": {
      "pp_pi": -0.264996485532,
      "pp_sigma": 1.003695441458,
      "sp_sigma": 0.600644776947,
      "ss_sigma": -0.90294051731
    },
    "R|R": {
      "pp_pi": -0.325648955963,
      "pp_sigma": 0.974974346123,
      "sp_sigma": 0.676876100291,
      "ss_sigma": -0.777139880814
    }
  },
  "lattice_vector": [
    2.251072335654,
    0.515806949987,
    0.222523099923
  ],
  "model_id": "hidden_ordinary_rotation",
  "neighbor_cutoff": 2.46010775611845,
  "phase_grid": [
    3.14159265359,
    -1.100357882597,
    0.0,
    1.678846691225,
    -2.039428192523,
    -0.630407996698,
    1.364114585712,
    2.118615491108,
    -1.270681830057,
    2.401427467862,
    -2.315039562141,
    -2.7143663853,
    -2.315039562141,
    0.957002290855,
    0.618671177,
    0.459957452523,
    -0.314196115388,
    -1.78660467755,
    -3.14159265359
  ],
  "schema_version": "periodic-orbital-device/v1",
  "sites": [
    {
      "id": "rot_left",
      "position": [
        0.0,
        0.0,
        0.0
      ],
      "species": "L"
    },
    {
      "id": "rot_right",
      "position": [
        1.030385172704,
        0.235600457534,
        -0.227373745806
      ],
      "species": "R"
    }
  ],
  "species": {
    "L": {
      "onsite": {
        "px": 0.39,
        "py": 0.78,
        "pz": 1.11,
        "s": -0.44
      },
      "orbitals": [
        "s",
        "px",
        "py",
        "pz"
      ]
    },
    "R": {
      "onsite": {
        "px": 0.55,
        "py": 0.89,
        "pz": 1.24,
        "s": 0.17
      },
      "orbitals": [
        "s",
        "px",
        "py",
        "pz"
      ]
    }
  }
}
