{
  "device": {
    "bond_scale": [
      1.031726305155,
      0.97585062641,
      1.191768960689,
      1.176707077822
    ],
    "cells": 5,
    "contact_scale_left": 1.12291199172,
    "contact_scale_right": 0.963345455108,
    "site_potential": [
      [
        -0.048078298617,
        -0.060512967178,
        0.034557501112
      ],
      [
        0.110435076947,
        -0.043263833536,
        -0.182002978728
      ],
      [
        0.086395780338,
        0.1849065765,
        -0.014426632507
      ],
      [
        0.182716074654,
        0.30444534962,
        0.08101427328
      ],
      [
        -0.103145077194,
        -0.014412689605,
        0.112314195932
      ]
    ]
  },
  "energy_grid": [
    -1.646254723427,
    -2.069723488657,
    1.851357893002,
    4.4676874892,
    -3.391543367092,
    3.294821714725,
    4.124888689957,
    -3.754777328206,
    2.384759939828,
    -0.687159327961,
    -4.279735322417,
    -4.728145386219,
    2.794804881623,
    -5.1,
    1.099827414739,
    3.5688371009,
    5.4,
    -2.85428112743,
    0.574092244011,
    -0.273567563003,
    -3.754777328206,
    -2.432087993759,
    1.502320180495,
    -1.199992860757,
    0.110214791787
  ],
  "eta": 0.07,
  "hoppings": {
    "P|P": {
      "pp_pi": -0.32516551623,
      "pp_sigma": 1.065330809496,
      "sp_sigma": 0.706500992727,
      "ss_sigma": -0.932820472708
    },
    "P|Q": {
      "pp_pi": -0.353204729903,
      "pp_sigma": 0.892762082331,
      "sp_sigma": 0.779242758278,
      "ss_sigma": -0.945218826142
    },
    "P|S": {
      "pp_pi": -0.330013473695,
      "pp_sigma": 1.114228542372,
      "sp_sigma": 0.832034415763,
      "ss_sigma": -0.975279228724
    },
    "Q|Q": {
      "pp_pi": -0.323670627192,
      "pp_sigma": 0.985877278226,
      "sp_sigma": 0.797298235684,
      "ss_sigma": -0.803527756719
    },
    "Q|S": {
      "pp_pi": -0.329003574227,
      "pp_sigma": 0.92221591909,
      "sp_sigma": 0.695089856037,
      "ss_sigma": -0.845581671374
    },
    "S|S": {
      "pp_pi": -0.280780789316,
      "pp_sigma": 1.193029468918,
      "sp_sigma": 0.714696002094,
      "ss_sigma": -0.864386383737
    }
  },
  "lattice_vector": [
    0.431692307692,
    0.758923076923,
    -2.260769230769
  ],
  "model_id": "public_rotated_multispecies",
  "neighbor_cutoff": 2.593509851434191,
  "phase_grid": [
    1.561807540839,
    -0.84250833146,
    0.870961524443,
    -2.273921085152,
    1.198466328847,
    0.447924338391,
    1.985344663409,
    -2.805561902612,
    -0.36696730162,
    2.383515314263,
    -1.274571822891,
    -1.536009545077,
    -2.273921085152,
    0.0,
    -1.869265420333,
    -3.14159265359,
    3.14159265359
  ],
  "schema_version": "periodic-orbital-device/v1",
  "sites": [
    {
      "id": "site_q",
      "position": [
        0.053538461538,
        0.521384615385,
        -1.416153846154
      ],
      "species": "Q"
    },
    {
      "id": "site_p",
      "position": [
        0.0,
        0.0,
        0.0
      ],
      "species": "P"
    },
    {
      "id": "site_s",
      "position": [
        0.447846153846,
        0.280461538462,
        -0.585384615385
      ],
      "species": "S"
    }
  ],
  "species": {
    "P": {
      "onsite": {
        "px": 0.48,
        "py": 0.73,
        "pz": 1.02,
        "s": -0.31
      },
      "orbitals": [
        "s",
        "px",
        "py",
        "pz"
      ]
    },
    "Q": {
      "onsite": {
        "px": 0.62,
        "py": 0.91,
        "pz": 1.17,
        "s": 0.22
      },
      "orbitals": [
        "s",
        "px",
        "py",
        "pz"
      ]
    },
    "S": {
      "onsite": {
        "s": -0.67
      },
      "orbitals": [
        "s"
      ]
    }
  }
}
