{
  "device": {
    "bond_scale": [
      1.084950447696,
      1.113053160219,
      1.031044149768
    ],
    "cells": 4,
    "contact_scale_left": 0.776044758819,
    "contact_scale_right": 0.987952471833,
    "site_potential": [
      [
        0.23856227718,
        0.1699643819,
        -0.436968744645
      ],
      [
        0.393929314415,
        0.001896982067,
        0.053429366948
      ],
      [
        0.235896952134,
        -0.020039534238,
        0.082106032943
      ],
      [
        -0.298803492325,
        0.128771327192,
        0.007620386509
      ]
    ]
  },
  "energy_grid": [
    4.035004265736,
    1.46444307298,
    -3.527120861695,
    -0.924410046148,
    2.352374050251,
    0.98300513782,
    -0.444033681241,
    4.59381638328,
    -1.248921592587,
    3.167304731423,
    2.679316057215,
    0.526753652707,
    -1.793073049586,
    -4.013531987167,
    -4.402642927882,
    1.790688493455,
    -5.8,
    -4.402642927882,
    5.9,
    -5.272704142915,
    -2.251347989012,
    -4.853464408879,
    0.034602629168,
    -3.024544950499,
    3.654324527684,
    -2.688116652762,
    4.983693767887
  ],
  "eta": 0.09,
  "hoppings": {
    "X|X": {
      "pp_pi": -0.299011303084,
      "pp_sigma": 0.936711061507,
      "sp_sigma": 0.759584559426,
      "ss_sigma": -0.828706533254
    },
    "X|Y": {
      "pp_pi": -0.318068693659,
      "pp_sigma": 1.106586582115,
      "sp_sigma": 0.632444992693,
      "ss_sigma": -0.915541542912
    },
    "Y|Y": {
      "pp_pi": -0.304971823854,
      "pp_sigma": 1.030190072543,
      "sp_sigma": 0.812577747798,
      "ss_sigma": -0.939763398945
    }
  },
  "lattice_vector": [
    2.64,
    -0.14,
    0.19
  ],
  "model_id": "hidden_site_permutation_permuted",
  "neighbor_cutoff": 2.820528249236367,
  "phase_grid": [
    -2.446610641354,
    0.512716975071,
    1.244190316634,
    -0.440480460115,
    2.519769944005,
    -1.866308783273,
    1.955382907438,
    0.0,
    -2.446610641354,
    0.890693387767,
    2.238704865871,
    -2.86256542162,
    1.487603908701,
    -0.575333482114,
    3.14159265359,
    -1.31879220508,
    0.284970070752,
    -2.165859007061,
    -1.544601967134,
    -0.838054811632,
    -3.14159265359
  ],
  "schema_version": "periodic-orbital-device/v1",
  "sites": [
    {
      "id": "site_x2",
      "position": [
        1.71,
        -0.23,
        0.16
      ],
      "species": "X"
    },
    {
      "id": "site_x0",
      "position": [
        0.0,
        0.0,
        0.0
      ],
      "species": "X"
    },
    {
      "id": "site_y1",
      "position": [
        0.83,
        0.26,
        -0.18
      ],
      "species": "Y"
    }
  ],
  "species": {
    "X": {
      "onsite": {
        "px": 0.24,
        "py": 0.58,
        "pz": 0.91,
        "s": -0.63
      },
      "orbitals": [
        "s",
        "px",
        "py",
        "pz"
      ]
    },
    "Y": {
      "onsite": {
        "px": 0.47,
        "py": 0.83,
        "pz": 1.19,
        "s": 0.06
      },
      "orbitals": [
        "s",
        "px",
        "py",
        "pz"
      ]
    }
  }
}
