{
  "device": {
    "bond_scale": [
      0.8942184544,
      0.840925261162,
      0.854474215024
    ],
    "cells": 4,
    "contact_scale_left": 0.91,
    "contact_scale_right": 1.08,
    "site_potential": [
      [
        0.08855452936,
        0.040932280519
      ],
      [
        0.040298507271,
        0.028003355105
      ],
      [
        0.037886476057,
        -0.078597947884
      ],
      [
        0.118169658112,
        0.032891261613
      ]
    ]
  },
  "energy_grid": [
    -3.9,
    -3.51,
    -3.12,
    -2.73,
    -2.34,
    -1.95,
    -1.56,
    -1.17,
    -0.78,
    -0.39,
    0.0,
    0.39,
    0.78,
    1.17,
    1.56,
    1.95,
    2.34,
    2.73,
    3.12,
    3.51,
    3.9
  ],
  "eta": 0.08,
  "hoppings": {
    "A|A": {
      "pp_pi": -0.19,
      "pp_sigma": 0.72,
      "sp_sigma": 0.41,
      "ss_sigma": -0.57
    },
    "A|B": {
      "pp_pi": -0.27,
      "pp_sigma": 0.88,
      "sp_sigma": 0.63,
      "ss_sigma": -1.04
    },
    "B|B": {
      "pp_pi": -0.23,
      "pp_sigma": 0.77,
      "sp_sigma": 0.52,
      "ss_sigma": -0.46
    }
  },
  "lattice_vector": [
    2.55,
    0.0,
    0.0
  ],
  "model_id": "public_scalar_diatomic",
  "neighbor_cutoff": 2.6,
  "phase_grid": [
    -3.14159265359,
    -2.617993877991,
    -2.094395102393,
    -1.570796326795,
    -1.047197551197,
    -0.523598775598,
    0.0,
    0.523598775598,
    1.047197551197,
    1.570796326795,
    2.094395102393,
    2.617993877991,
    3.14159265359
  ],
  "schema_version": "periodic-orbital-device/v1",
  "sites": [
    {
      "id": "left_A",
      "position": [
        0.0,
        0.0,
        0.0
      ],
      "species": "A"
    },
    {
      "id": "right_B",
      "position": [
        1.18,
        0.0,
        0.0
      ],
      "species": "B"
    }
  ],
  "species": {
    "A": {
      "onsite": {
        "s": -0.38
      },
      "orbitals": [
        "s"
      ]
    },
    "B": {
      "onsite": {
        "s": 0.54
      },
      "orbitals": [
        "s"
      ]
    }
  }
}
