{
  "device": {
    "bond_scale": [
      0.901795521986,
      0.882838918743,
      1.143369328354,
      0.854396751948,
      1.238431037427
    ],
    "cells": 6,
    "contact_scale_left": 0.873584350568,
    "contact_scale_right": 0.727698196329,
    "site_potential": [
      [
        -0.119647212728,
        0.051231004885,
        0.047302476678
      ],
      [
        -0.255011710135,
        0.249844674668,
        0.275007577795
      ],
      [
        -0.09134707273,
        0.284049673372,
        -0.177079502947
      ],
      [
        0.405927192195,
        -0.128815703393,
        -0.002340620628
      ],
      [
        -0.417705236378,
        0.143932641074,
        -0.076550577832
      ],
      [
        -0.193532903448,
        -0.246205621005,
        0.230013754507
      ]
    ]
  },
  "energy_grid": [
    3.566718162863,
    -1.645546540062,
    4.034491706745,
    -3.364737154481,
    1.863867884229,
    3.073912268132,
    -0.314018826043,
    -2.936962546557,
    -1.273212480534,
    -2.521303765326,
    -3.832438145646,
    0.486697629589,
    -4.340687345208,
    1.444676352032,
    2.311380774452,
    2.779822530732,
    -4.7,
    0.143711428714,
    0.911212824321,
    -2.005312397192,
    -3.364737154481,
    4.9,
    -0.708156800883
  ],
  "eta": 0.09,
  "hoppings": {
    "M|M": {
      "pp_pi": -0.324896216014,
      "pp_sigma": 0.975966474638,
      "sp_sigma": 0.715924908592,
      "ss_sigma": -0.912846117583
    },
    "M|N": {
      "pp_pi": -0.262849270444,
      "pp_sigma": 1.001376115726,
      "sp_sigma": 0.804849604223,
      "ss_sigma": -0.794815405405
    },
    "M|O": {
      "pp_pi": -0.336911332386,
      "pp_sigma": 0.955780559375,
      "sp_sigma": 0.797610361985,
      "ss_sigma": -1.011803031681
    },
    "N|N": {
      "pp_pi": -0.352618755603,
      "pp_sigma": 0.974239508654,
      "sp_sigma": 0.863661672378,
      "ss_sigma": -1.013137734017
    },
    "N|O": {
      "pp_pi": -0.333762936085,
      "pp_sigma": 1.103507712519,
      "sp_sigma": 0.858015884705,
      "ss_sigma": -0.975677312586
    },
    "O|O": {
      "pp_pi": -0.390744237363,
      "pp_sigma": 1.06018373158,
      "sp_sigma": 0.855892544871,
      "ss_sigma": -0.879060228681
    }
  },
  "lattice_vector": [
    2.39,
    -0.16,
    0.21
  ],
  "model_id": "hidden_ordinary_permutation",
  "neighbor_cutoff": 2.564537377542716,
  "phase_grid": [
    3.14159265359,
    0.0,
    2.317739440206,
    -2.310283768919,
    1.452263605395,
    -1.828332770623,
    -2.310283768919,
    -3.14159265359,
    -2.651012780265,
    1.820056997598,
    -1.311827294487,
    -1.023424450933,
    -0.486157200086,
    0.439477870857,
    0.915784329304
  ],
  "schema_version": "periodic-orbital-device/v1",
  "sites": [
    {
      "id": "first_id",
      "position": [
        0.72,
        0.26,
        -0.17
      ],
      "species": "N"
    },
    {
      "id": "last_id",
      "position": [
        1.51,
        -0.22,
        0.19
      ],
      "species": "O"
    },
    {
      "id": "middle_id",
      "position": [
        0.0,
        0.0,
        0.0
      ],
      "species": "M"
    }
  ],
  "species": {
    "M": {
      "onsite": {
        "px": 0.31,
        "py": 0.66,
        "pz": 0.95,
        "s": -0.53
      },
      "orbitals": [
        "s",
        "px",
        "py",
        "pz"
      ]
    },
    "N": {
      "onsite": {
        "s": 0.28
      },
      "orbitals": [
        "s"
      ]
    },
    "O": {
      "onsite": {
        "s": -0.14
      },
      "orbitals": [
        "s"
      ]
    }
  }
}
