{
  "device": {
    "bond_scale": [
      0.832409637863,
      0.883605403809,
      1.03564731607,
      1.084558486068
    ],
    "cells": 5,
    "contact_scale_left": 0.881726938623,
    "contact_scale_right": 0.81564015288,
    "site_potential": [
      [
        -0.090797453659,
        0.319832459801,
        -0.067177164275
      ],
      [
        0.015678656039,
        0.077360384214,
        0.057512109399
      ],
      [
        -0.04465019254,
        -0.134578185632,
        -0.187337964628
      ],
      [
        -0.101058133081,
        0.051092291359,
        -0.120115912678
      ],
      [
        -0.128865685492,
        -0.191774790782,
        0.075867515384
      ]
    ]
  },
  "energy_grid": [
    -2.863448770013,
    1.248748216464,
    -2.507189992642,
    -0.238181330761,
    -1.776833766643,
    -3.2,
    -1.333550642375,
    3.4,
    0.03233166107,
    -2.126381512781,
    -0.568650568896,
    1.918402372982,
    0.764241320619,
    2.25171694103,
    2.735614414073,
    1.625971509252,
    -1.056956674796,
    -2.126381512781,
    0.425554703604
  ],
  "eta": 0.12,
  "hoppings": {
    "Edge|Edge": {
      "pp_pi": -0.228339486158,
      "pp_sigma": 0.757788174486,
      "sp_sigma": 0.61895137851,
      "ss_sigma": -0.666185824052
    }
  },
  "lattice_vector": [
    2.3,
    0.0,
    0.0
  ],
  "model_id": "hidden_cutoff_edge",
  "neighbor_cutoff": 2.3,
  "phase_grid": [
    0.0,
    0.741424892476,
    1.854513441284,
    3.14159265359,
    -1.853346516896,
    -3.14159265359,
    -1.159928123937,
    1.330406427444,
    -0.504926560657,
    -1.853346516896,
    -2.59471001063
  ],
  "schema_version": "periodic-orbital-device/v1",
  "sites": [
    {
      "id": "origin",
      "position": [
        0.0,
        0.0,
        0.0
      ],
      "species": "Edge"
    },
    {
      "id": "inside_epsilon",
      "position": [
        0.0,
        2.3000000000005,
        0.0
      ],
      "species": "Edge"
    },
    {
      "id": "outside_epsilon",
      "position": [
        0.0,
        -2.3000000000015,
        0.0
      ],
      "species": "Edge"
    }
  ],
  "species": {
    "Edge": {
      "onsite": {
        "s": 0.13
      },
      "orbitals": [
        "s"
      ]
    }
  }
}
